condition,g_flags,g_means,y_flags,y_means,r_flags,r_means
Digestive Health,"If you have:
No abdominal pain or discomfort 
Have regular bowel movements 
Digestive issues managed with medications and/or diet. ","Good work!
Your symptoms are under control 
","If you have:
Problems with belching 
Constipation or diarrhea 
Fatigue/weakness
Dark, tarry stools, or noticeable blood in your stool 
Loss of appetite 
Feeling of nausea 
Unexplained weight loss 
Vomiting 
Fever of 102 or higher 
Stomach cramps that do not go away ","You may need follow-up by your PCP
Your medication may need to be adjusted. 
The medication may be effecting your digestive system ","If you: 
Rectal bleeding or blood in your stool 
Persistent abdominal discomfort, such as cramps, gas, or pain. 
A feeling that your bowel doesn’t empty completely 
Weakness or fatigue 
Unexplained weight loss 
A change in your bowel habits—like diarrhea or constipation—or a change in the consistency of your stool. 
Do not have a bowel movement, particularly when taking a narcotic for three or more days",You need to be evaluated by a health care professional immediately.
Fall Prevention,"If you have: 
No falls and are not afraid of falling 
Regularly exercise per primary care doctor instructions 
Feel steady on your feet when walking
Use any assistive devices as recommended by your doctor or physical therapist. 
Environment free of trip hazards. ",Good work!,"If you have:
Problems taking your medications as prescribed by your medical provider (e.g., you miss or skip doses, have difficulty understanding directions, or take medications that cause dizziness, fatigue, or weakness)
Lightheadedness when you stand up
Reduced muscle strength in legs
Painful or unstable ankles, knees, or hips 
Decreased sensation in your legs or feet 
Blurred vision 
Clutter and trip hazards in your home
History of falls of any type 
Diagnosis of osteoporosis 
Difficulty walking
Balance problems when walking
Unable to get up from the floor without help","You are at a higher risk for falls. 
Your medication may need to be adjusted
You may need to take Vitamin D 
You may need an eye exam 
You may need a physical therapist
You may benefit from a home safety evaluation","If you have: 
Extreme dizziness or loss of consciousness
Had a fall and have difficulty standing, moving a limb, or cannot weight bear 
Had a fall and have trouble thinking clearly or staying awake
Head injury or trauma from a fall
",You need to be evaluated by a health care professional immediately.
Anticoagulant,"If you have:
INR within the range recommended by your PCP","
Good work!
Your symptoms are under control 
","When you: 
Add, change, or stop any medicine, or take:
Coumadin—high drug-food and drug-drug interactions 
Antibiotics—can cause INR to change","You may need follow-up by your primary care provider
The medication may be causing side effects.
Your medication may need to be adjusted","If you have: 
Rectal bleeding or red blood in your stool 
Arm, back, or jaw pain 
Blue or purple toes 
Change in consciousness 
Increase in chest tightness or heaviness
Fast or irregular heartbeat
Trouble breathing with exertion
Severe abdominal pain or stomach pain 
A fall or injury, especially to the head ","If possible, notify your health care provider’s office 

Name:

Number:

Follow these instructions: CALL 9-1-1
"
KidneyHealthNonDialysis,"If you have:
Potassium level in your blood is between 3.5-5.4
No symptoms listed in the yellow or red flags
Your blood pressure is within the range set by your health care provider 
Your cholesterol levels are within the range set by your health care provider 
You take medicines as prescribed ","
Good work!","If you have:
Potassium level in your blood is between 5.4-6.
Notice blood in your urine 
Dark brown urine or cloudy urine 
Foamy urine noticed in the toilet 
Swelling of your hands and feet
Increased weakness, shortness of breath, or tiredness
Increased blood pressure, chest pain, or shortness of breath with exertion. 
Nausea, vomiting or loss of appetite
Bruise easily 
Skin itching
Lightheadedness with standing
","Your Potassium level is in the caution area. Discuss with nutritionist what are high potassium foods to avoid 
You could have a kidney infection 
You could have kidney disease or the kidney disease is getting worse 
You may need your diuretic (water pill) dose adjusted","If you have:
Change in level of consciousness; extreme sleepiness or difficulty awakening 
Severe fatigue 
Chest pain 
Difficulty breathing and decreased response to your diuretic (water pill)
Severe nausea and vomiting 
Little or no urine output 
A very slow heart rate (less than 50 beats/minute or a very rapid heart rate (more than 120 beats/minutes
Severe bleeding (from any source)
Muscle weakness 
Seizures ","Your potassium level could be too high; 6.0 or higher 
Kidney disease is getting worse"
LiverDisease,"If you:
Follow a healthy diet
Take medicines as directed by your health care provider
Practice good health habits, including hand washing",Good work!,"If you:
Have yellow color to your skin
Have abdominal pain, or swelling in your abdomen 
Have stool that is pale, tar-colored or bloody
Have dark urine
Have headaches
Itchy skin  
Whites of your eyes appear yellow
Feel tired all the time 
Feel nauseated or lose your appetite 
Bruise easily 
Have CHF and it is not well controlled 
Have confusion","You are at higher risk of having non-alcoholic fatty liver
You may have liver disease or your liver disease is getting worse 
","If you: 
Have severe shortness of breath
Weight gain, 
Persisting fever, vomiting, and abdominal pain ",You need to be evaluated by a health care professional immediately.
Pneumonia,"
If you:
Have no shortness of breath, fever below 100, no or slight cough, no chest pain, and eating and drinking liquids normally 
Are prescribed medications, and you take as directed.
","
Good work!
If you have pneumonia, medications and treatments are helping control infection.","If you:
Feel tired or weak 
Have increased difficulty breathing 
Have a fever of 100.4 more than 72 hours 
Have Increased coughing or wheezing
Have yellow/green color to material you are coughing up. 
Have had a cold and you get worse instead of better 
","You may have developed an infection, or your medication may need to be changed ","If you have:  
Trouble breathing, or breathing faster than normal, with or without exercise. 
Confusion, trouble thinking clearly
New chest pain that gets worse when you take a deep breath or cough 
Blood in the material you are coughing up 
A fever and shaking chills 
A fall and you can’t get up 
",You need to be evaluated by a health care professional immediately.
Chronic Pain,"If you have:
No pain 
Pain does not limit what you are able to do. 
If you are taking medicine, particularly a stronger pain reliever like an opioid, your bowel patterns are regular (e.g., every day, every other day) ","Your symptoms/pain is under control or in a range that does not limit your daily activities 
Your pain level could be considered controlled or “mild discomfort”. 
Continue to take your medicine as ordered by your doctor. 
","If you have:
Pain that limits what you are able to do or 
Pain that interferes with what you want or need to do, including your basic care needs or makes it difficult to concentrate. 
Pain that causes low mood or less interest in social activities. 
No regular bowel movement for 3 or more days ","You may need your medicine adjusted 
Talk with your medical provider about elimination problems. 
Your pain level is considered moderately controlled or ‘moderate discomfort” ","Call your doctor, consulting nurse, or health care provider if symptoms do not improve. 

Name: 

Number: 

Instructions:
","You may need your medicine adjusted 
Talk with your medical provider about elimination problems. 
Your pain level is considered moderately controlled or ‘moderate discomfort” ","If you have: 
Pain that is severe
You cannot take care of your basic needs  
The pain does not respond to medicine 
Pain is constant without relief
Shallow breathing or trouble staying awake 
No bowel movements 

","Your pain level could be considered uncontrolled or “severe discomfort”
You may be having a severe side effect to the pain-relieving medicine.
Do not take your next dose of opioid  
You need to be evaluated by a health care professional immediately.","If possible, notify your health care provider’s office. 

Name:

Number:

Follow these instructions: CALL 9-1-1
","Your pain level could be considered uncontrolled or “severe discomfort”
You may be having a severe side effect to the pain-relieving medicine.
Do not take your next dose of opioid  
You need to be evaluated by a health care professional immediately."
